{
  "totalEventCount": 142,
  "counts": [
    { "category": "syn", "count": 48 },
    { "category": "bg",  "count": 22 },
    { "category": "hlt", "count": 31 },
    { "category": "loc", "count": 18 },
    { "category": "lif", "count": 14 },
    { "category": "con", "count": 9  }
  ],
  "fileSizeBytes": 24576,
  "entries": [
    { "id": "00000000-0000-0000-0000-000000000001", "category": "syn", "timestamp": "2025-01-15T12:33:48Z", "message": "Sync cycle completed" },
    { "id": "00000000-0000-0000-0000-000000000002", "category": "hlt", "timestamp": "2025-01-15T12:33:30Z", "message": "Heart sample batch posted" },
    { "id": "00000000-0000-0000-0000-000000000003", "category": "bg",  "timestamp": "2025-01-15T12:32:11Z", "message": "Background refresh scheduled" },
    { "id": "00000000-0000-0000-0000-000000000004", "category": "loc", "timestamp": "2025-01-15T12:30:02Z", "message": "Region monitoring resumed" },
    { "id": "00000000-0000-0000-0000-000000000005", "category": "lif", "timestamp": "2025-01-15T12:28:55Z", "message": "App entered foreground" },
    { "id": "00000000-0000-0000-0000-000000000006", "category": "con", "timestamp": "2025-01-15T12:27:00Z", "message": "Reachability changed" }
  ],
  "transferStatus": "idle",
  "referenceDate": "2025-01-15T12:34:00Z"
}
